{
  "$schema": "https://json-schema.org/draft/2020-12/schema",
  "$id": "https://formspec.org/schemas/locale/2.0",
  "title": "Formspec Locale Document (v2.0)",
  "description": "A Formspec Locale Document provides internationalized strings for one exact Definition or App Manifest target. Locale 2.0 replaces targetDefinition with target.kind plus target.url, admits the closed Surface shell key family, uses FEL {{expression}} interpolation as its only authored template syntax, and keeps every fallback step within the same target identity. A Locale Document MUST NOT affect data collection, validation logic, authorization, or behavioral semantics.",
  "type": "object",
  "required": [
    "$formspecLocale",
    "version",
    "locale",
    "target",
    "strings"
  ],
  "additionalProperties": false,
  "allOf": [
    {
      "if": {
        "properties": {
          "strings": {
            "not": {
              "propertyNames": {
                "not": {
                  "pattern": "^\\$module\\.x-formspec-surface\\.shell\\."
                }
              }
            }
          }
        },
        "required": [
          "strings"
        ]
      },
      "then": {
        "properties": {
          "target": {
            "properties": {
              "kind": {
                "const": "app"
              }
            },
            "required": [
              "kind"
            ]
          }
        }
      }
    },
    {
      "if": {
        "properties": {
          "strings": {
            "not": {
              "propertyNames": {
                "not": {
                  "pattern": "^\\$ui\\."
                }
              }
            }
          }
        },
        "required": [
          "strings"
        ]
      },
      "then": {
        "properties": {
          "target": {
            "properties": {
              "kind": {
                "const": "definition"
              }
            },
            "required": [
              "kind"
            ]
          }
        }
      }
    }
  ],
  "properties": {
    "$formspecLocale": {
      "type": "string",
      "const": "2.0",
      "description": "Locale specification version. MUST be '2.0'.",
      "examples": [
        "2.0"
      ],
      "x-lm": {
        "critical": true,
        "intent": "Version pin for locale document compatibility. Processors MUST reject locale documents with an unrecognized version."
      }
    },
    "modules": {
      "type": "array",
      "description": "OPTIONAL declaration of substrate modules this document depends on. Each entry is a canonical ModuleRef. Module-contributed Locale string keys use $module.<modId>.<nodeId>.<prop>. The x-formspec-surface module reserves the closed $module.x-formspec-surface.shell.<SurfaceStringKey> family for app-targeted shell text.",
      "items": {
        "$ref": "https://formspec.org/schemas/common/1.0#/$defs/ModuleRef"
      },
      "examples": [
        [
          {
            "id": "x-formspec-conversation",
            "version": "^0.1.0"
          }
        ]
      ]
    },
    "url": {
      "type": "string",
      "format": "uri",
      "description": "Canonical identifier for this Locale Document. Stable across versions — the tuple (url, version) SHOULD be globally unique.",
      "examples": [
        "https://agency.gov/forms/budget/locales/fr-CA",
        "https://example.org/forms/intake/locales/es"
      ]
    },
    "version": {
      "type": "string",
      "minLength": 1,
      "description": "Version of this Locale Document. SemVer is RECOMMENDED. The tuple (url, version) SHOULD be unique across all published locale versions.",
      "examples": [
        "1.0.0",
        "2.1.0-beta.1"
      ],
      "x-lm": {
        "critical": true,
        "intent": "Locale document revision identifier. Enables cache-busting and auditing which locale version was applied."
      }
    },
    "name": {
      "type": "string",
      "description": "Machine-friendly short identifier for programmatic use.",
      "examples": [
        "budget-fr-CA",
        "intake-es"
      ]
    },
    "title": {
      "type": "string",
      "description": "Human-readable display name for the Locale Document.",
      "examples": [
        "Budget Form — Canadian French",
        "Patient Intake — Spanish"
      ]
    },
    "description": {
      "type": "string",
      "description": "Human-readable description of the locale's purpose and target audience.",
      "examples": [
        "French-Canadian localization for the annual budget form.",
        "Latin American Spanish translations for the patient intake questionnaire."
      ]
    },
    "locale": {
      "type": "string",
      "minLength": 2,
      "pattern": "^[a-zA-Z]{2,3}(-[a-zA-Z0-9]{2,8})*$",
      "description": "BCP 47 language tag identifying the locale this document provides strings for. Processors MUST perform case-insensitive comparison and SHOULD normalize to lowercase language with title-case region (e.g., 'fr-CA').",
      "examples": [
        "en",
        "en-US",
        "fr-CA",
        "zh-Hans",
        "ar",
        "pt-BR"
      ],
      "x-lm": {
        "critical": true,
        "intent": "Identifies the language/region this locale covers. Used as the lookup key when setLocale() is called and as the cascade entry point."
      }
    },
    "fallback": {
      "type": "string",
      "minLength": 2,
      "pattern": "^[a-zA-Z]{2,3}(-[a-zA-Z0-9]{2,8})*$",
      "description": "BCP 47 language tag of the locale to consult when a key is not found in this document's strings. Enables explicit fallback chains (e.g., fr-CA → fr). If absent, the cascade proceeds to implicit language fallback (strip region subtag) or inline defaults. Processors MUST detect circular fallback chains and terminate the cascade with a warning.",
      "examples": [
        "fr",
        "en",
        "zh"
      ]
    },
    "formats": {
      "type": "object",
      "additionalProperties": false,
      "description": "How this locale writes values that FEL formats by style. formats.date maps a formatDate style name (short, medium, long, full) to a pattern; a style without a pattern keeps the processor's built-in rendering for the locale. Patterns use the ICU letters yyyy, yy, MMMM, MMM, MM, M, dd, d, EEEE, EEE; every other character is literal. A Definition never carries a pattern: it names the style, the Locale decides the shape.",
      "properties": {
        "date": {
          "type": "object",
          "additionalProperties": false,
          "properties": {
            "short": {
              "type": "string",
              "minLength": 1
            },
            "medium": {
              "type": "string",
              "minLength": 1
            },
            "long": {
              "type": "string",
              "minLength": 1
            },
            "full": {
              "type": "string",
              "minLength": 1
            }
          }
        }
      },
      "examples": [
        {
          "date": {
            "medium": "MM/dd/yyyy",
            "full": "EEEE, MM/dd/yyyy"
          }
        }
      ]
    },
    "target": {
      "$ref": "#/$defs/LocaleTarget",
      "description": "Exact Definition or App Manifest target. Loaded Locale identity is (target.kind, target.url, normalized locale). A processor MUST NOT apply this document to another target or cross target identity during fallback.",
      "examples": [
        {
          "kind": "definition",
          "url": "https://agency.gov/forms/budget",
          "compatibleVersions": ">=1.0.0 <2.0.0"
        },
        {
          "kind": "app",
          "url": "https://example.org/apps/intake"
        }
      ],
      "x-lm": {
        "critical": true,
        "intent": "Declares the exact Definition or app this Locale can be applied to and bounds fallback to that target."
      }
    },
    "strings": {
      "type": "object",
      "additionalProperties": {
        "type": "string"
      },
      "propertyNames": {
        "pattern": "^(\\$form\\.|\\$shape\\.|\\$page\\.|\\$optionSet\\.|\\$component\\.|\\$module\\.x-|\\$ui\\.|\\$action\\.|[a-zA-Z])[a-zA-Z0-9_@.\\\\\\[\\]\\-]*$",
        "allOf": [
          {
            "if": {
              "pattern": "^\\$module\\.x-formspec-surface\\.shell\\."
            },
            "then": {
              "$ref": "#/$defs/SurfaceShellStringKey"
            }
          },
          {
            "if": {
              "pattern": "^\\$ui\\."
            },
            "then": {
              "$ref": "#/$defs/ChromeStringKey"
            }
          }
        ],
        "description": "String keys are dot-delimited. Item strings use <itemKey>.<property>, where <itemKey> is the bare Item key at any depth (amount.label for lineItems[*].amount); dotted template paths such as lineItems.amount.label are not valid item keys. The $module.x-formspec-surface.shell.<SurfaceStringKey> family is closed to the exact SurfaceShellStringKey enum. The $ui.<ChromeStringKey> family (target.kind: definition) is closed to the exact ChromeStringKey enum — renderer chrome strings, {{$param}} filled literally, never FEL. Other module keys retain $module.<modId>.<nodeId>.<prop> addressing."
      },
      "description": "Map of string keys to localized values. Values are strings and MAY contain FEL interpolation only through {{expression}} syntax. Surface-only {name} placeholders are not a second template language. Shell keys use the read-only shell variable context defined by the Locale specification.",
      "examples": [
        {
          "$form.title": "Rapport annuel sur les subventions",
          "projectName.label": "Nom du projet",
          "projectName.hint": "Entrez le nom officiel du projet",
          "budgetSection.label": "Section budgétaire",
          "budgetSection.label@short": "Budget",
          "fundingStatus.options.yes.label": "Oui",
          "fundingStatus.options.no.label": "Non",
          "$optionSet.yesNoNA.yes.label": "Oui",
          "$optionSet.yesNoNA.no.label": "Non",
          "email.errors.REQUIRED": "L'adresse courriel est obligatoire",
          "email.errors.CONSTRAINT_FAILED": "Veuillez entrer une adresse courriel valide",
          "ssn.constraintMessage": "Le NAS doit être au format 000-000-000",
          "$shape.budget-balance.message": "Le total doit correspondre au financement",
          "$page.info.title": "Informations du projet",
          "$page.review.title": "Révision et soumission",
          "$component.submitBtn.label": "Soumettre la demande",
          "$component.mainTabs.tabLabels[0]": "Personnel",
          "lineItems.label": "Poste {{@index}}",
          "totalItems.label": "Total : {{$itemCount}} {{if(pluralCategory($itemCount) = 'one', 'article', 'articles')}}"
        }
      ],
      "x-lm": {
        "critical": true,
        "intent": "The core payload of a Locale Document. Each entry overrides one localizable string for the exact target. Values support FEL interpolation for dynamic content."
      }
    },
    "stringGeneration": {
      "type": "object",
      "additionalProperties": {
        "$ref": "https://formspec.org/schemas/common/1.0#/$defs/Generation"
      },
      "propertyNames": {
        "pattern": "^(\\$form\\.|\\$shape\\.|\\$page\\.|\\$optionSet\\.|\\$component\\.|\\$module\\.x-|\\$ui\\.|\\$action\\.|[a-zA-Z])[a-zA-Z0-9_@.\\\\\\[\\]\\-]*$"
      },
      "description": "Generation provenance keyed exactly like strings. Strict data-only authoring profiles require every authored localized string to have a same-key direct current adopted Need anchor."
    },
    "extensions": {
      "type": "object",
      "propertyNames": {
        "pattern": "^x-"
      },
      "description": "Extension namespace for vendor-specific or tooling-specific metadata. All keys MUST be x- prefixed. Processors MUST ignore unrecognized extensions. Extensions MUST NOT alter locale resolution semantics.",
      "examples": [
        {
          "x-translator": {
            "tool": "Crowdin",
            "projectId": "budget-form"
          },
          "x-coverage": {
            "percentage": 92,
            "lastUpdated": "2026-03-15"
          }
        }
      ]
    }
  },
  "$defs": {
    "LocaleTarget": {
      "type": "object",
      "required": [
        "kind",
        "url"
      ],
      "additionalProperties": false,
      "properties": {
        "kind": {
          "type": "string",
          "enum": [
            "definition",
            "app"
          ],
          "description": "Target artifact kind. No aliases or additional kinds are admitted in Locale 2.0."
        },
        "url": {
          "type": "string",
          "format": "uri",
          "pattern": "^[A-Za-z][A-Za-z0-9+.-]*:.+",
          "description": "Canonical absolute URL of the target Definition or App Manifest."
        },
        "compatibleVersions": {
          "type": "string",
          "minLength": 1,
          "description": "Optional SemVer range checked against the selected target's version."
        }
      }
    },
    "SurfaceShellStringKey": {
      "type": "string",
      "enum": [
        "$module.x-formspec-surface.shell.slotUnavailableDefinitionForm",
        "$module.x-formspec-surface.shell.slotUnavailableExperienceUnit",
        "$module.x-formspec-surface.shell.slotUnavailableWidgetUnimplemented",
        "$module.x-formspec-surface.shell.slotUnavailableWidgetIncompatible",
        "$module.x-formspec-surface.shell.slotUnavailableWidgetUndeclared",
        "$module.x-formspec-surface.shell.slotUnavailableWidgetData",
        "$module.x-formspec-surface.shell.slotUnavailableStaticContent",
        "$module.x-formspec-surface.shell.slotUnavailableEmbedUnresolved",
        "$module.x-formspec-surface.shell.slotUnavailableEmbedCycle",
        "$module.x-formspec-surface.shell.widgetEmpty",
        "$module.x-formspec-surface.shell.notFoundTitle",
        "$module.x-formspec-surface.shell.notFoundBody",
        "$module.x-formspec-surface.shell.navigationLabel",
        "$module.x-formspec-surface.shell.transitionContinue",
        "$module.x-formspec-surface.shell.transitionPending",
        "$module.x-formspec-surface.shell.transitionFailed",
        "$module.x-formspec-surface.shell.transitionTargetUnresolved",
        "$module.x-formspec-surface.shell.transitionTargetCollision",
        "$module.x-formspec-surface.shell.transitionNoResponseActions",
        "$module.x-formspec-surface.shell.transitionTriggerUnresolved",
        "$module.x-formspec-surface.shell.transitionTriggerAmbiguous",
        "$module.x-formspec-surface.shell.transitionNoExecutor",
        "$module.x-formspec-surface.shell.transitionSuppliedBySlot",
        "$module.x-formspec-surface.shell.transitionFireable"
      ],
      "description": "Closed one-to-one mapping to SurfaceStringKey. A new shell string requires a Locale schema revision."
    },
    "ChromeStringKey": {
      "type": "string",
      "enum": [
        "$ui.select.placeholder",
        "$ui.select.clearSelection",
        "$ui.select.selectedValues",
        "$ui.select.selectAll",
        "$ui.repeat.add",
        "$ui.repeat.remove",
        "$ui.repeat.row",
        "$ui.repeat.rowOf",
        "$ui.repeat.rowNamed",
        "$ui.wizard.next",
        "$ui.wizard.nextStep",
        "$ui.wizard.previous",
        "$ui.wizard.previousStep",
        "$ui.wizard.skip",
        "$ui.wizard.skipStep",
        "$ui.wizard.submit",
        "$ui.wizard.submitForm",
        "$ui.wizard.steps",
        "$ui.wizard.progress",
        "$ui.wizard.step",
        "$ui.wizard.collapseNavigation",
        "$ui.wizard.otherItems",
        "$ui.modal.close",
        "$ui.alert.dismiss",
        "$ui.validationSummary.heading",
        "$ui.date.format",
        "$ui.characterCount.limit",
        "$ui.characterCount.allowed",
        "$ui.characterCount.left",
        "$ui.characterCount.leftOne",
        "$ui.characterCount.over",
        "$ui.characterCount.overOne",
        "$ui.signature.clear",
        "$ui.signature.canvas",
        "$ui.money.amount",
        "$ui.money.currency",
        "$ui.fieldHelp.label",
        "$ui.screener.continue",
        "$ui.screener.required",
        "$ui.screener.back",
        "$ui.dataTable.addRow",
        "$ui.dataTable.remove",
        "$ui.dataTable.removeRow",
        "$ui.dataTable.actions",
        "$ui.wizard.stepTitle",
        "$ui.wizard.stepStatus",
        "$ui.wizard.finalStepStatus",
        "$ui.wizard.stepAnnouncement",
        "$ui.wizard.finalStepAnnouncement",
        "$ui.wizard.expandNavigation",
        "$ui.select.loadingOptions",
        "$ui.select.remoteFallback",
        "$ui.select.remoteFailed",
        "$ui.modal.open",
        "$ui.fileUpload.dropzone",
        "$ui.fileUpload.dropzoneKeyboard",
        "$ui.fileUpload.browse",
        "$ui.fileUpload.attachedList",
        "$ui.fileUpload.pendingList",
        "$ui.fileUpload.remove",
        "$ui.fileUpload.dismissError",
        "$ui.fileUpload.uploading",
        "$ui.fileUpload.uploadProgress",
        "$ui.fileUpload.deferredLibrary",
        "$ui.fileUpload.cameraCapture",
        "$ui.fileUpload.cameraPreview",
        "$ui.fileUpload.captureImage",
        "$ui.fileUpload.closeCamera",
        "$ui.fileUpload.useCamera",
        "$ui.fileUpload.cameraUnavailable",
        "$ui.fileUpload.cameraOpenFailed",
        "$ui.fileUpload.cameraCaptureFailed",
        "$ui.fileUpload.imagesWaitingOne",
        "$ui.fileUpload.imagesWaitingMany",
        "$ui.fileUpload.imageReview",
        "$ui.fileUpload.legibilityWarning",
        "$ui.fileUpload.redactionSurface",
        "$ui.fileUpload.previewImage",
        "$ui.fileUpload.addRedaction",
        "$ui.fileUpload.detectPageEdges",
        "$ui.fileUpload.clearRedactions",
        "$ui.fileUpload.uploadImage",
        "$ui.fileUpload.cancel",
        "$ui.fileUpload.browseMultiple",
        "$ui.fileUpload.dropzoneMultiple",
        "$ui.fileUpload.attachedOne",
        "$ui.fileUpload.attachedMany",
        "$ui.fileUpload.fileTooLarge",
        "$ui.fileUpload.errorTooLarge",
        "$ui.fileUpload.errorMimeRejected",
        "$ui.fileUpload.errorNetwork",
        "$ui.fileUpload.errorUnavailable",
        "$ui.fileUpload.errorUnknown",
        "$ui.fileUpload.imagePrepareFailed",
        "$ui.fileUpload.edgeCleanupFailed",
        "$ui.fileUpload.singleFileOnly",
        "$ui.validationSummary.fixOne",
        "$ui.validationSummary.fixMany",
        "$ui.validationSummary.reviewOne",
        "$ui.validationSummary.reviewMany",
        "$ui.validationSummary.review",
        "$ui.validationSummary.errorCountOne",
        "$ui.validationSummary.errorCount",
        "$ui.validationSummary.issueCountOne",
        "$ui.validationSummary.issueCount",
        "$ui.validationSummary.row",
        "$ui.action.submit",
        "$ui.action.inProgress",
        "$ui.action.completed",
        "$ui.action.blocked",
        "$ui.action.failed",
        "$ui.action.deferred",
        "$ui.action.unresolved",
        "$ui.action.status",
        "$ui.action.statusReason",
        "$ui.screener.submit",
        "$ui.screener.answerOne",
        "$ui.assist.filled"
      ],
      "description": "Closed one-to-one mapping to the renderer chrome string inventory (Locale spec §3.1.10, packages/formspec-layout/src/ui-strings.ts). A new chrome string requires a Locale schema revision."
    }
  }
}
